"hep-th/9212016","Peter West","Peter West","On the spectrum, no ghost theorem and modular invariance of $W_3$
  strings","23 pages, KCL-TH-92-7","Int.J.Mod.Phys. A8 (1993) 2875-2894","10.1142/S0217751X93001168",,"hep-th",,"  A spectrum generating algebra is constructed and used to find all the
physical states of the $W_3$ string with standard ghost number. These states
are shown to have positive norm and their partition function is found to
involve the Ising model characters corresponding to the weights 0 and 1/16. The
theory is found to be modular invariant if , in addition, one includes states
that correspond to the Ising character of weight 1/2. It is shown that these
additional states are indeed contained in the cohomology of $Q$.
","[{""version"":""v1"",""created"":""Wed, 2 Dec 1992 15:19:00 GMT""}]","2015-06-26"
"math/9212201",,"Sy D. Friedman (MIT)","Jensen's \Sigma^* theory and the combinatorial content of V=L",,,,"Logic E-prints December 02, 1992","math.LO",,"  The purpose of this article is to indicate how a reformulation of Jensen's
$\Sigma^*$ theory (developed for the study of core models) can be used to
provide a more satisfactory treatment of uniformization, hulls and Skolem
functions for the $J_\alpha$'s. Then we use this approach to fine structure to
formulate a principle intended to capture the combinatorial content of the
axiom $V=L.$
","[{""version"":""v1"",""created"":""Wed, 2 Dec 1992 00:00:00 GMT""}]","2008-02-03"
"math/9212202",,"Sy D. Friedman (MIT)","A large Pi-1-2 set absolute for set forcing",,,,"Logic E-prints December 02, 1992","math.LO",,"  Let k be a definable L-cardinal. Then there is a set of reals X,
class-generic over L, such that L(X) and L have the same cardinals, X has size
k in L(X) and some pi-1-2 formula defines X in all set-generic extensions of
L(X). Two corollaries, both assuming the consistency of an inaccessible: It is
consistent for the Perfect Set Property to hold for boldface sigma-1-2 sets,
yet fail for some lightface pi-1-2 set. It is consistent that the Perfect Set
Property holds for boldface sigma-1-2 sets yet some lightface pi-1-2
wellordering of some set of reals has length aleph-1000.
","[{""version"":""v1"",""created"":""Wed, 2 Dec 1992 00:00:00 GMT""}]","2009-09-25"
"nucl-th/9212001",,"V.F.Dmitriev","The Nuclear Response in Delta-Isobar Region in the ($^3\!$He,t) Reaction","29 pages including 8 figures, IU/NTC 92-34",,"10.1103/PhysRevC.48.357",,"nucl-th",,"  The excitation of a $\Delta$-isobar in a finite nucleus in charge--exchange
($^3\!$He,t) reaction is discussed in terms of a nuclear response function. The
medium effects modifying a $\Delta$- and a pion propagation were considered for
a finite size nucleus. The Glauber approach has been used for distortion of a
$^3\!$He and a triton in the initial and the final states. The effects
determining the peak positions and its width are discussed. Large displacement
width for the $\Delta$ - h excitations and considerable contribution of
coherent pion production were found for the reaction on $^{12}$C.
","[{""version"":""v1"",""created"":""Wed, 2 Dec 1992 15:35:00 GMT""}]","2009-10-22"
